{
  "acceptance_passed": true,
  "claim_boundary": {
    "bounded_completeness_claimed": true,
    "global_minimum_claimed": false,
    "mutation_profile_driven": true,
    "mutation_scope": "8 application-profile-controlled non-equivalent AIR mutants executed with the external AIR executor"
  },
  "comparison_run_id": "COMPARE-RUN-6424F8EB98E1",
  "comparisons": [
    {
      "baseline": "manual-requirements",
      "candidate": "manual-closure",
      "cycle_change_percent": 82.758621,
      "cycle_delta": 24,
      "mcdc_delta": 0,
      "mutation_kill_delta": 0,
      "obligation_coverage_delta": 87,
      "scenario_change_percent": 100.0,
      "scenario_delta": 24
    },
    {
      "baseline": "manual-closure",
      "candidate": "automatic-unreduced",
      "cycle_change_percent": 1358.490566,
      "cycle_delta": 720,
      "mcdc_delta": 0,
      "mutation_kill_delta": 0,
      "obligation_coverage_delta": 0,
      "scenario_change_percent": 593.75,
      "scenario_delta": 285
    },
    {
      "baseline": "manual-closure",
      "candidate": "automatic-obligation-reduced",
      "cycle_change_percent": 167.924528,
      "cycle_delta": 89,
      "mcdc_delta": 0,
      "mutation_kill_delta": -1,
      "obligation_coverage_delta": 0,
      "scenario_change_percent": 18.75,
      "scenario_delta": 9
    },
    {
      "baseline": "manual-closure",
      "candidate": "automatic-mutation-aware-reduced",
      "cycle_change_percent": 175.471698,
      "cycle_delta": 93,
      "mcdc_delta": 0,
      "mutation_kill_delta": 0,
      "obligation_coverage_delta": 0,
      "scenario_change_percent": 20.833333,
      "scenario_delta": 10
    },
    {
      "baseline": "automatic-unreduced",
      "candidate": "automatic-obligation-reduced",
      "cycle_change_percent": -81.630013,
      "cycle_delta": -631,
      "mcdc_delta": 0,
      "mutation_kill_delta": -1,
      "obligation_coverage_delta": 0,
      "scenario_change_percent": -82.882883,
      "scenario_delta": -276
    },
    {
      "baseline": "automatic-unreduced",
      "candidate": "automatic-mutation-aware-reduced",
      "cycle_change_percent": -81.112549,
      "cycle_delta": -627,
      "mcdc_delta": 0,
      "mutation_kill_delta": 0,
      "obligation_coverage_delta": 0,
      "scenario_change_percent": -82.582583,
      "scenario_delta": -275
    },
    {
      "baseline": "automatic-obligation-reduced",
      "candidate": "automatic-mutation-aware-reduced",
      "cycle_change_percent": 2.816901,
      "cycle_delta": 4,
      "mcdc_delta": 0,
      "mutation_kill_delta": 1,
      "obligation_coverage_delta": 0,
      "scenario_change_percent": 1.754386,
      "scenario_delta": 1
    }
  ],
  "deterministic": true,
  "final_automatic_complete": true,
  "manual_suite_gate": true,
  "manual_suite_gate_passed": true,
  "passed": true,
  "profile_version": "ASCP-0.2",
  "program_id": "AIR-PROG-E1DC8CAED523",
  "replay_passed": true,
  "schema_version": "AEROST-ASSURANCE-SUITE-COMPARISON-0.2",
  "suite_count": 5,
  "suites": [
    {
      "cycle_count": 29,
      "fault_reset_recovery": {
        "complete": true,
        "covered": 7,
        "total": 7
      },
      "mcdc": {
        "complete": true,
        "covered": 6,
        "total": 6
      },
      "mutation": {
        "killed": 8,
        "records": [
          {
            "first_detection": {
              "cycle": 0,
              "scenario_id": "TEST-PWR-SOURCE-A-001"
            },
            "killed": true,
            "mutant_id": "MUT-DUAL-SOURCE-OPERATOR",
            "operator": "dual-source-operator"
          },
          {
            "first_detection": {
              "cycle": 0,
              "scenario_id": "TEST-PWR-RESERVE-001"
            },
            "killed": true,
            "mutant_id": "MUT-CRITICAL-CONDITION",
            "operator": "critical-condition"
          },
          {
            "first_detection": {
              "cycle": 0,
              "scenario_id": "TEST-PWR-BUS-CRITICAL-001"
            },
            "killed": true,
            "mutant_id": "MUT-CRITICAL-TARGET",
            "operator": "critical-target"
          },
          {
            "first_detection": {
              "cycle": 0,
              "scenario_id": "TEST-PWR-STARTUP-A-INDEPENDENCE-001"
            },
            "killed": true,
            "mutant_id": "MUT-CRITICAL-OUTPUT-DELETE",
            "operator": "critical-output-delete"
          },
          {
            "first_detection": {
              "cycle": 0,
              "scenario_id": "TEST-PWR-STARTUP-WAIT-001"
            },
            "killed": true,
            "mutant_id": "MUT-PAYLOAD-DEFAULT",
            "operator": "payload-default"
          },
          {
            "first_detection": {
              "cycle": 0,
              "scenario_id": "TEST-PWR-INVALID-001"
            },
            "killed": true,
            "mutant_id": "MUT-INVALID-OUTPUT-GUARD",
            "operator": "invalid-output-guard"
          },
          {
            "first_detection": {
              "cycle": 0,
              "scenario_id": "TEST-PWR-RECOVERY-STABLE-FALSE-001"
            },
            "killed": true,
            "mutant_id": "MUT-WEAKEN-RECOVERY",
            "operator": "weaken-recovery"
          },
          {
            "first_detection": {
              "cycle": 0,
              "scenario_id": "TEST-PWR-SOURCE-A-001"
            },
            "killed": true,
            "mutant_id": "MUT-SWAP-ISOLATION",
            "operator": "swap-isolation"
          }
        ],
        "score_percent": 100.0,
        "surviving": [],
        "total": 8
      },
      "name": "manual-requirements",
      "obligations": {
        "by_kind": {
          "CASE_ARM_REACHED": {
            "covered": 14,
            "percent": 100.0,
            "total": 14
          },
          "CONDITION_FALSE": {
            "covered": 46,
            "percent": 62.162162,
            "total": 74
          },
          "CONDITION_TRUE": {
            "covered": 49,
            "percent": 66.216216,
            "total": 74
          },
          "CONSERVATIVE_OUTPUT_APPLIED": {
            "covered": 1,
            "percent": 100.0,
            "total": 1
          },
          "DECISION_FALSE": {
            "covered": 22,
            "percent": 75.862069,
            "total": 29
          },
          "DECISION_TRUE": {
            "covered": 17,
            "percent": 58.62069,
            "total": 29
          },
          "FAULT_POLICY_ACTIVATED": {
            "covered": 1,
            "percent": 100.0,
            "total": 1
          },
          "MCDC_PAIR": {
            "covered": 6,
            "percent": 100.0,
            "total": 6
          },
          "NORMAL_COMMIT_INHIBITED": {
            "covered": 1,
            "percent": 100.0,
            "total": 1
          },
          "RECOVERY_PATH_EXECUTED": {
            "covered": 2,
            "percent": 100.0,
            "total": 2
          },
          "REQUIREMENT_EXERCISED": {
            "covered": 15,
            "percent": 100.0,
            "total": 15
          },
          "RESET_PATH_EXECUTED": {
            "covered": 2,
            "percent": 100.0,
            "total": 2
          },
          "STATEMENT_REACHED": {
            "covered": 64,
            "percent": 81.012658,
            "total": 79
          }
        },
        "covered": 240,
        "percent": 73.394495,
        "total": 327,
        "uncovered_count": 87,
        "uncovered_ids": [
          "OBL-COND-AIR-COND-00908D0AC570-TRUE",
          "OBL-COND-AIR-COND-1342E8B61A2A-TRUE",
          "OBL-COND-AIR-COND-144BC0B8AB3F-FALSE",
          "OBL-COND-AIR-COND-14721A8DD0AF-FALSE",
          "OBL-COND-AIR-COND-15F32731B053-FALSE",
          "OBL-COND-AIR-COND-160BD1733874-FALSE",
          "OBL-COND-AIR-COND-160BD1733874-TRUE",
          "OBL-COND-AIR-COND-2C0CE59B2B64-FALSE",
          "OBL-COND-AIR-COND-2D0D9A9B15DB-FALSE",
          "OBL-COND-AIR-COND-2F99F25465C8-TRUE",
          "OBL-COND-AIR-COND-36B0D097C415-TRUE",
          "OBL-COND-AIR-COND-3BDC2757859D-FALSE",
          "OBL-COND-AIR-COND-40809FD7BD8C-FALSE",
          "OBL-COND-AIR-COND-418210273076-FALSE",
          "OBL-COND-AIR-COND-50A7117E5BB5-TRUE",
          "OBL-COND-AIR-COND-592BFC643C74-TRUE",
          "OBL-COND-AIR-COND-5B282D6B19D0-FALSE",
          "OBL-COND-AIR-COND-5B282D6B19D0-TRUE",
          "OBL-COND-AIR-COND-66F919A4468C-TRUE",
          "OBL-COND-AIR-COND-679C2BD98047-TRUE",
          "OBL-COND-AIR-COND-6FC64088584E-FALSE",
          "OBL-COND-AIR-COND-741536FE89BA-FALSE",
          "OBL-COND-AIR-COND-7475F8D3D8FD-FALSE",
          "OBL-COND-AIR-COND-79C6E960DBD5-FALSE",
          "OBL-COND-AIR-COND-7E3F9A986A6A-TRUE",
          "OBL-COND-AIR-COND-817FF4A2CA56-TRUE",
          "OBL-COND-AIR-COND-83F3B5EB4933-FALSE",
          "OBL-COND-AIR-COND-97DBB6731217-FALSE",
          "OBL-COND-AIR-COND-9C40B9684FA7-TRUE",
          "OBL-COND-AIR-COND-A47FB4F62113-FALSE",
          "OBL-COND-AIR-COND-A60A2BD8F2FD-FALSE",
          "OBL-COND-AIR-COND-B3AB2C8B1E72-TRUE",
          "OBL-COND-AIR-COND-B75BA1081948-FALSE",
          "OBL-COND-AIR-COND-BA77AC6CEF43-TRUE",
          "OBL-COND-AIR-COND-BABD48A64B79-TRUE",
          "OBL-COND-AIR-COND-BB61825D52A7-TRUE",
          "OBL-COND-AIR-COND-BC1A60139F1A-TRUE",
          "OBL-COND-AIR-COND-C14F85047E54-TRUE",
          "OBL-COND-AIR-COND-C9A77B0A56A4-TRUE",
          "OBL-COND-AIR-COND-CC11C4447B85-FALSE",
          "OBL-COND-AIR-COND-D2D9B19380C7-TRUE",
          "OBL-COND-AIR-COND-D3BFA46CC2AB-FALSE",
          "OBL-COND-AIR-COND-DC2862148359-FALSE",
          "OBL-COND-AIR-COND-E13100E69473-TRUE",
          "OBL-COND-AIR-COND-E3220C881F3F-FALSE",
          "OBL-COND-AIR-COND-E627EE416F1A-FALSE",
          "OBL-COND-AIR-COND-E9CE4594367D-FALSE",
          "OBL-COND-AIR-COND-EE98B9F464DC-FALSE",
          "OBL-COND-AIR-COND-F4060203942C-TRUE",